{
  "version": 1,
  "source": "greggles/mcc-codes",
  "sourceUrl": "https://raw.githubusercontent.com/greggles/mcc-codes/main/mcc_codes.json",
  "importedAt": "2026-06-23",
  "codes": {
    "1520": {
      "en": "General Contractors-Residential and Commercial",
      "pt": "Construtoras gerais (residencial e comercial)"
    },
    "1711": {
      "en": "Air Conditioning Contractors – Sales and Installation, Heating Contractors – Sales, Service, Installation",
      "pt": "Instalação de ar-condicionado, aquecimento e encanamento"
    },
    "1731": {
      "en": "Electrical Contractors",
      "pt": "Empreiteiras elétricas"
    },
    "1740": {
      "en": "Insulation – Contractors, Masonry, Stonework Contractors, Plastering Contractors, Stonework and Masonry Contractors, Tile Settings Contractors",
      "pt": "Empreiteiras de isolamento, alvenaria, pedraria e revestimento"
    },
    "1750": {
      "en": "Carpentry Contractors",
      "pt": "Carpinteiros e marcenarias"
    },
    "1761": {
      "en": "Roofing – Contractors, Sheet Metal Work – Contractors, Siding – Contractors",
      "pt": "Telhamento, serralheria e fachadas"
    },
    "1771": {
      "en": "Contractors – Concrete Work",
      "pt": "Construtores de concreto"
    },
    "1799": {
      "en": "Contractors – Special Trade, Not Elsewhere Classified",
      "pt": "Empreiteiras especiais"
    },
    "2741": {
      "en": "Miscellaneous Publishing and Printing",
      "pt": "Publicações e impressão variadas"
    },
    "2791": {
      "en": "Typesetting, Plate Making, & Related Services",
      "pt": "Tipografia, criação de placas e serviços relacionados"
    },
    "2842": {
      "en": "Specialty Cleaning, Polishing, and Sanitation Preparations",
      "pt": "Limpeza e preparação especializada (polimento e higienização)"
    },
    "3000": {
      "en": "UNITED AIRLINES",
      "pt": "United Airlines"
    },
    "3001": {
      "en": "AMERICAN AIRLINES",
      "pt": "American Airlines"
    },
    "3002": {
      "en": "PAN AMERICAN",
      "pt": "Pan American"
    },
    "3003": {
      "en": "Airlines",
      "pt": "Companhias aéreas"
    },
    "3004": {
      "en": "TRANS WORLD AIRLINES",
      "pt": "Trans World Airlines"
    },
    "3005": {
      "en": "BRITISH AIRWAYS",
      "pt": "British Airways"
    },
    "3006": {
      "en": "JAPAN AIRLINES",
      "pt": "Japan Airlines"
    },
    "3007": {
      "en": "AIR FRANCE",
      "pt": "Air France"
    },
    "3008": {
      "en": "LUFTHANSA",
      "pt": "Lufthansa"
    },
    "3009": {
      "en": "AIR CANADA",
      "pt": "Air Canada"
    },
    "3010": {
      "en": "KLM (ROYAL DUTCH AIRLINES)",
      "pt": "KLM (Royal Dutch Airlines)"
    },
    "3011": {
      "en": "AEORFLOT",
      "pt": "Aeroflot"
    },
    "3012": {
      "en": "QANTAS",
      "pt": "Qantas"
    },
    "3013": {
      "en": "ALITALIA",
      "pt": "Alitalia"
    },
    "3014": {
      "en": "SAUDIA ARABIAN AIRLINES",
      "pt": "Saudia Arabian Airlines"
    },
    "3015": {
      "en": "SWISSAIR",
      "pt": "Swissair"
    },
    "3016": {
      "en": "SAS",
      "pt": "Sas"
    },
    "3017": {
      "en": "SOUTH AFRICAN AIRWAYS",
      "pt": "South African Airways"
    },
    "3018": {
      "en": "VARIG (BRAZIL)",
      "pt": "Varig (Brazil)"
    },
    "3019": {
      "en": "Airlines",
      "pt": "Companhias aéreas"
    },
    "3020": {
      "en": "AIR-INDIA",
      "pt": "Air India"
    },
    "3021": {
      "en": "AIR ALGERIE",
      "pt": "Air Algerie"
    },
    "3022": {
      "en": "PHILIPPINE AIRLINES",
      "pt": "Philippine Airlines"
    },
    "3023": {
      "en": "MEXICANA",
      "pt": "Mexicana"
    },
    "3024": {
      "en": "PAKISTAN INTERNATIONAL",
      "pt": "Pakistan International"
    },
    "3025": {
      "en": "AIR NEW ZEALAND",
      "pt": "Air New Zealand"
    },
    "3026": {
      "en": "Airlines",
      "pt": "Companhias aéreas"
    },
    "3027": {
      "en": "UTA/INTERAIR",
      "pt": "UTA/Interair"
    },
    "3028": {
      "en": "AIR MALTA",
      "pt": "Air Malta"
    },
    "3029": {
      "en": "SABENA",
      "pt": "Sabena"
    },
    "3030": {
      "en": "AEROLINEAS ARGENTINAS",
      "pt": "Aerolineas Argentinas"
    },
    "3031": {
      "en": "OLYMPIC AIRWAYS",
      "pt": "Olympic Airways"
    },
    "3032": {
      "en": "EL AL",
      "pt": "El Al"
    },
    "3033": {
      "en": "ANSETT AIRLINES",
      "pt": "Ansett Airlines"
    },
    "3034": {
      "en": "AUSTRAINLIAN AIRLINES",
      "pt": "Australian Airlines"
    },
    "3035": {
      "en": "TAP (PORTUGAL)",
      "pt": "TAP (Portugal)"
    },
    "3036": {
      "en": "VASP (BRAZIL)",
      "pt": "VASP (Brazil)"
    },
    "3037": {
      "en": "EGYPTAIR",
      "pt": "Egyptair"
    },
    "3038": {
      "en": "KUWAIT AIRLINES",
      "pt": "Kuwait Airlines"
    },
    "3039": {
      "en": "AVIANCA",
      "pt": "Avianca"
    },
    "3040": {
      "en": "GULF AIR (BAHRAIN)",
      "pt": "Gulf Air (Bahrain)"
    },
    "3041": {
      "en": "BALKAN-BULGARIAN AIRLINES",
      "pt": "Balkan-Bulgarian Airlines"
    },
    "3042": {
      "en": "FINNAIR",
      "pt": "Finnair"
    },
    "3043": {
      "en": "AER LINGUS",
      "pt": "Aer Lingus"
    },
    "3044": {
      "en": "AIR LANKA",
      "pt": "Air Lanka"
    },
    "3045": {
      "en": "NIGERIA AIRWAYS",
      "pt": "Nigeria Airways"
    },
    "3046": {
      "en": "CRUZEIRO DO SUL (BRAZIJ)",
      "pt": "Cruzeiro Do Sul (Brazij)"
    },
    "3047": {
      "en": "THY (TURKEY)",
      "pt": "THY (Turkey)"
    },
    "3048": {
      "en": "ROYAL AIR MAROC",
      "pt": "Royal Air Maroc"
    },
    "3049": {
      "en": "TUNIS AIR",
      "pt": "Tunis Air"
    },
    "3050": {
      "en": "ICELANDAIR",
      "pt": "Icelandair"
    },
    "3051": {
      "en": "AUSTRIAN AIRLINES",
      "pt": "Austrian Airlines"
    },
    "3052": {
      "en": "LANCHILE",
      "pt": "Lanchile"
    },
    "3053": {
      "en": "AVIACO (SPAIN)",
      "pt": "Aviaco (Spain)"
    },
    "3054": {
      "en": "LADECO (CHILE)",
      "pt": "Ladeco (Chile)"
    },
    "3055": {
      "en": "LAB (BOLIVIA)",
      "pt": "LAB (Bolivia)"
    },
    "3056": {
      "en": "QUEBECAIRE",
      "pt": "Quebecaire"
    },
    "3057": {
      "en": "EASTWEST AIRLINES (AUSTRALIA)",
      "pt": "Eastwest Airlines (Australia)"
    },
    "3058": {
      "en": "DELTA",
      "pt": "Delta"
    },
    "3059": {
      "en": "Airlines",
      "pt": "Companhias aéreas"
    },
    "3060": {
      "en": "NORTHWEST",
      "pt": "Northwest"
    },
    "3061": {
      "en": "CONTINENTAL",
      "pt": "Continental"
    },
    "3062": {
      "en": "WESTERN",
      "pt": "Western"
    },
    "3063": {
      "en": "US AIR",
      "pt": "Us Air"
    },
    "3064": {
      "en": "Airlines",
      "pt": "Companhias aéreas"
    },
    "3065": {
      "en": "AIRINTER",
      "pt": "Airinter"
    },
    "3066": {
      "en": "SOUTHWEST",
      "pt": "Southwest"
    },
    "3067": {
      "en": "Airlines",
      "pt": "Companhias aéreas"
    },
    "3068": {
      "en": "Airlines",
      "pt": "Companhias aéreas"
    },
    "3069": {
      "en": "SUN COUNTRY AIRLINES",
      "pt": "Sun Country Airlines"
    },
    "3070": {
      "en": "Airlines",
      "pt": "Companhias aéreas"
    },
    "3071": {
      "en": "AIR BRITISH COLUBIA",
      "pt": "Air British Colubia"
    },
    "3072": {
      "en": "Airlines",
      "pt": "Companhias aéreas"
    },
    "3073": {
      "en": "Airlines",
      "pt": "Companhias aéreas"
    },
    "3074": {
      "en": "Airlines",
      "pt": "Companhias aéreas"
    },
    "3075": {
      "en": "SINGAPORE AIRLINES",
      "pt": "Singapore Airlines"
    },
    "3076": {
      "en": "AEROMEXICO",
      "pt": "Aeromexico"
    },
    "3077": {
      "en": "THAI AIRWAYS",
      "pt": "Thai Airways"
    },
    "3078": {
      "en": "CHINA AIRLINES",
      "pt": "China Airlines"
    },
    "3079": {
      "en": "Airlines",
      "pt": "Companhias aéreas"
    },
    "3080": {
      "en": "Airlines",
      "pt": "Companhias aéreas"
    },
    "3081": {
      "en": "NORDAIR",
      "pt": "Nordair"
    },
    "3082": {
      "en": "KOREAN AIRLINES",
      "pt": "Korean Airlines"
    },
    "3083": {
      "en": "AIR AFRIGUE",
      "pt": "Air Afrigue"
    },
    "3084": {
      "en": "EVA AIRLINES",
      "pt": "EVA Airlines"
    },
    "3085": {
      "en": "MIDWEST EXPRESS AIRLINES, INC.",
      "pt": "Midwest Express Airlines, Inc."
    },
    "3086": {
      "en": "Airlines",
      "pt": "Companhias aéreas"
    },
    "3087": {
      "en": "METRO AIRLINES",
      "pt": "Metro Airlines"
    },
    "3088": {
      "en": "CROATIA AIRLINES",
      "pt": "Croatia Airlines"
    },
    "3089": {
      "en": "TRANSAERO",
      "pt": "Transaero"
    },
    "3090": {
      "en": "Airlines",
      "pt": "Companhias aéreas"
    },
    "3091": {
      "en": "Airlines",
      "pt": "Companhias aéreas"
    },
    "3092": {
      "en": "Airlines",
      "pt": "Companhias aéreas"
    },
    "3093": {
      "en": "Airlines",
      "pt": "Companhias aéreas"
    },
    "3094": {
      "en": "ZAMBIA AIRWAYS",
      "pt": "Zambia Airways"
    },
    "3095": {
      "en": "Airlines",
      "pt": "Companhias aéreas"
    },
    "3096": {
      "en": "AIR ZIMBABWE",
      "pt": "Air Zimbabwe"
    },
    "3097": {
      "en": "Airlines",
      "pt": "Companhias aéreas"
    },
    "3098": {
      "en": "Airlines",
      "pt": "Companhias aéreas"
    },
    "3099": {
      "en": "CATHAY PACIFIC",
      "pt": "Cathay Pacific"
    },
    "3100": {
      "en": "MALAYSIAN AIRLINE SYSTEM",
      "pt": "Malaysian Airline System"
    },
    "3101": {
      "en": "Airlines",
      "pt": "Companhias aéreas"
    },
    "3102": {
      "en": "IBERIA",
      "pt": "Iberia"
    },
    "3103": {
      "en": "GARUDA (INDONESIA)",
      "pt": "Garuda (Indonesia)"
    },
    "3104": {